<?xml version="1.0" encoding="UTF-8"?>
<!DOCTYPE issues SYSTEM "C:\Users\Administrateur\Desktop\PROJECT MAILSTONE\2app\communication\DTD\response\response.dtd">
<issues code="r001">
    <issue>
        <product>
            <ref>000</ref>
            <date>22-11-2022</date>
            <name>reference</name>
            <brand>toshiba</brand>
            <category>
                <name/>
            </category>
            <client>
                <firstname>Idriss</firstname>
                <lastname>Benguezzou</lastname>
                <email>idrissbenguezzou@gmail.com</email>
                <address/>
                <phoneNumber/>
            </client>
        </product>
        <description>Mon pc affiche un Ã©cran noir  il ne s allume plus   </description>
        <resolved>false</resolved>
        <solution>
            <description/>
            <cost/>
            <duration/>
        </solution>
    </issue>
</issues>
